{
  "canonical_sha256": "9cf47070c75bbf66f5e9919c32b5847b886a2f02190ea844c55273bb5ac4f751",
  "dataset_manifest_sha256": "557fd46fcfaa1c2618be315bced7f9f0ba381d8f45119929a200a9d12d1895bf",
  "evaluation_size": [
    256,
    256
  ],
  "experiment_version": "mvtec-ad2-v1",
  "public_gate_identity": "5cb50fd6e7226ebccfdf3564d494d1890458fbcb29e8b3ae3182130ddfcc2409",
  "runs": [
    {
      "category": "can",
      "checkpoint_sha256": "3c6481c50c9e5f699ddb2b74c12f66c936bcdd1017776816126ecf15ce014be6",
      "code_revision": "04c54b81aac20fb7ea3f509e4ee29fb1a717125d",
      "config_sha256": "04da55509dcc89524451e6fc10c0697dc9ab08d8155f4cef17a1ba4b4cef0e43",
      "dataset_manifest_sha256": "557fd46fcfaa1c2618be315bced7f9f0ba381d8f45119929a200a9d12d1895bf",
      "environment_lock_sha256": "49fdf43b70cd7dd82bb64b791a86c1533c5926a8ad801b3688588dcc1cb2a158",
      "family": "dinomaly",
      "metrics": {
        "artifact_size_bytes": 1329040463,
        "evaluation_size": [
          256,
          256
        ],
        "gpu_latency": {
          "batch_size": 1,
          "device": "gpu",
          "p50_ms": 41.94949999509845,
          "p95_ms": 73.13847997429548,
          "samples": 162,
          "schema_version": "1.0.0",
          "setup_latency_ms": 54757.01570013189,
          "throughput_images_per_second": 23.34695724419268
        },
        "image": {
          "anomaly_count": 90,
          "auroc": 0.5177469135802469,
          "average_precision": 0.5622318956589761,
          "metric_contract_version": "1.0.0",
          "normal_count": 72,
          "schema_version": "1.0.0"
        },
        "operating": {
          "expected_reviews_per_1000_normal": 375.0,
          "public_anomaly_recall": 0.4111111111111111,
          "public_normal_false_review_rate": 0.375,
          "public_review_f1": 0.4805194805194805,
          "public_review_precision": 0.578125,
          "schema_version": "1.0.0",
          "threshold": 0.05025326833128929
        },
        "peak_vram_mib": 659.86669921875,
        "per_image_failure_rate": 0.0,
        "pixel": {
          "anomaly_pixel_count": 468,
          "au_pro": 0.2979582841884795,
          "auroc": 0.7437588758316717,
          "average_precision": 9.989272215633125e-05,
          "metric_contract_version": "1.0.0",
          "normal_pixel_count": 10616364,
          "pro_fpr_limit": 0.3,
          "region_count": 96,
          "schema_version": "1.0.0"
        },
        "schema_version": "1.0.0"
      },
      "model_revision": "anomalib:2.5.0/Dinomaly/dinov2reg_vit_base_14",
      "prediction_artifact_sha256": "6b3a4906ae3dc267996b9dd8762029bca1b0ae02e08f9a87e7ef5b30e1c02dfc",
      "prediction_locator": "public-evaluation/959be543842f678e3cda3ff1bc1430bb4dc3d407b3711b1a2de9236906de9aaf/predictions/test_public.json",
      "run_identity": "959be543842f678e3cda3ff1bc1430bb4dc3d407b3711b1a2de9236906de9aaf",
      "run_record_sha256": "59ca614029405e64d2bd796a6f206f9d989922265e3ac4a3cb26084f492e88b4",
      "schema_version": "1.0.0",
      "seed": 17,
      "stage": "replication",
      "threshold_artifact_sha256": "6ee5ede06382851b71c94040b456df4660d2e0bdb878feb97341e55f728349c2"
    },
    {
      "category": "can",
      "checkpoint_sha256": "bd07559d08cd85f8def329a573e937017f29224a38ccc95e46a92bd788fcae42",
      "code_revision": "04c54b81aac20fb7ea3f509e4ee29fb1a717125d",
      "config_sha256": "04da55509dcc89524451e6fc10c0697dc9ab08d8155f4cef17a1ba4b4cef0e43",
      "dataset_manifest_sha256": "557fd46fcfaa1c2618be315bced7f9f0ba381d8f45119929a200a9d12d1895bf",
      "environment_lock_sha256": "49fdf43b70cd7dd82bb64b791a86c1533c5926a8ad801b3688588dcc1cb2a158",
      "family": "dinomaly",
      "metrics": {
        "artifact_size_bytes": 1329040463,
        "evaluation_size": [
          256,
          256
        ],
        "gpu_latency": {
          "batch_size": 1,
          "device": "gpu",
          "p50_ms": 40.67370000007031,
          "p95_ms": 76.47347000008719,
          "samples": 162,
          "schema_version": "1.0.0",
          "setup_latency_ms": 55455.61229999817,
          "throughput_images_per_second": 21.398109125702156
        },
        "image": {
          "anomaly_count": 90,
          "auroc": 0.5132716049382716,
          "average_precision": 0.5602948441766473,
          "metric_contract_version": "1.0.0",
          "normal_count": 72,
          "schema_version": "1.0.0"
        },
        "operating": {
          "expected_reviews_per_1000_normal": 375.0,
          "public_anomaly_recall": 0.4222222222222222,
          "public_normal_false_review_rate": 0.375,
          "public_review_f1": 0.4903225806451613,
          "public_review_precision": 0.5846153846153846,
          "schema_version": "1.0.0",
          "threshold": 0.049940839409828186
        },
        "peak_vram_mib": 659.86669921875,
        "per_image_failure_rate": 0.0,
        "pixel": {
          "anomaly_pixel_count": 468,
          "au_pro": 0.3005203883817808,
          "auroc": 0.7556199896470421,
          "average_precision": 0.00011465290625354329,
          "metric_contract_version": "1.0.0",
          "normal_pixel_count": 10616364,
          "pro_fpr_limit": 0.3,
          "region_count": 96,
          "schema_version": "1.0.0"
        },
        "schema_version": "1.0.0"
      },
      "model_revision": "anomalib:2.5.0/Dinomaly/dinov2reg_vit_base_14",
      "prediction_artifact_sha256": "b1bbd78c65b7b1f0620e1629ac84bb147713eced3580fdb561161391fc5bf0f2",
      "prediction_locator": "public-evaluation/fcc4b2c90275cd585b79adb1e33be05cfc18222d41af235dfcba22bab3016cd3/predictions/test_public.json",
      "run_identity": "fcc4b2c90275cd585b79adb1e33be05cfc18222d41af235dfcba22bab3016cd3",
      "run_record_sha256": "7bc9dc2f45baa6241300b5ff673bdfebf487567d9626421a3e472ac30a94c1b7",
      "schema_version": "1.0.0",
      "seed": 42,
      "stage": "screening",
      "threshold_artifact_sha256": "5c87ebf218cd36fa23c307c9bb63875ac67c9a3cb8a70392e1daeba10213477a"
    },
    {
      "category": "can",
      "checkpoint_sha256": "4e28408930ad76fafda1948f962243657ab1a2233092989c7dfa4e5799460d7c",
      "code_revision": "04c54b81aac20fb7ea3f509e4ee29fb1a717125d",
      "config_sha256": "04da55509dcc89524451e6fc10c0697dc9ab08d8155f4cef17a1ba4b4cef0e43",
      "dataset_manifest_sha256": "557fd46fcfaa1c2618be315bced7f9f0ba381d8f45119929a200a9d12d1895bf",
      "environment_lock_sha256": "49fdf43b70cd7dd82bb64b791a86c1533c5926a8ad801b3688588dcc1cb2a158",
      "family": "dinomaly",
      "metrics": {
        "artifact_size_bytes": 1329040463,
        "evaluation_size": [
          256,
          256
        ],
        "gpu_latency": {
          "batch_size": 1,
          "device": "gpu",
          "p50_ms": 40.03094999643508,
          "p95_ms": 45.27090001211035,
          "samples": 162,
          "schema_version": "1.0.0",
          "setup_latency_ms": 36133.338600135176,
          "throughput_images_per_second": 24.60777186398683
        },
        "image": {
          "anomaly_count": 90,
          "auroc": 0.5141975308641975,
          "average_precision": 0.5635306614898266,
          "metric_contract_version": "1.0.0",
          "normal_count": 72,
          "schema_version": "1.0.0"
        },
        "operating": {
          "expected_reviews_per_1000_normal": 375.0,
          "public_anomaly_recall": 0.4222222222222222,
          "public_normal_false_review_rate": 0.375,
          "public_review_f1": 0.4903225806451613,
          "public_review_precision": 0.5846153846153846,
          "schema_version": "1.0.0",
          "threshold": 0.050326090306043625
        },
        "peak_vram_mib": 659.86669921875,
        "per_image_failure_rate": 0.0,
        "pixel": {
          "anomaly_pixel_count": 468,
          "au_pro": 0.29995164908385397,
          "auroc": 0.755676554476631,
          "average_precision": 0.00011666235518379373,
          "metric_contract_version": "1.0.0",
          "normal_pixel_count": 10616364,
          "pro_fpr_limit": 0.3,
          "region_count": 96,
          "schema_version": "1.0.0"
        },
        "schema_version": "1.0.0"
      },
      "model_revision": "anomalib:2.5.0/Dinomaly/dinov2reg_vit_base_14",
      "prediction_artifact_sha256": "7a483505c59f83e102e61895c6979883108901cef3506bebb149a8af86af4487",
      "prediction_locator": "public-evaluation/46e4689fb88bbcf7889bf48002e17dae6b5d131ceaf65330b6f175e02f7b2cdd/predictions/test_public.json",
      "run_identity": "46e4689fb88bbcf7889bf48002e17dae6b5d131ceaf65330b6f175e02f7b2cdd",
      "run_record_sha256": "d236ab457dea4831d12a8fc73f7aa1db123d007338adb9f6a656b061d9ec6833",
      "schema_version": "1.0.0",
      "seed": 2026,
      "stage": "replication",
      "threshold_artifact_sha256": "5343bcee7d86962cada151a3c92322ff10da6351eaf04832f0ffd385d7031fa6"
    },
    {
      "category": "can",
      "checkpoint_sha256": "312533211d2697f39c4722294b18d2142318ea7fa9c3004f11c7f4efafa4748e",
      "code_revision": "04c54b81aac20fb7ea3f509e4ee29fb1a717125d",
      "config_sha256": "7b03017ec1328a45d6b1b18ae33efcc29542e4175582f351492709af84d6cc10",
      "dataset_manifest_sha256": "557fd46fcfaa1c2618be315bced7f9f0ba381d8f45119929a200a9d12d1895bf",
      "environment_lock_sha256": "49fdf43b70cd7dd82bb64b791a86c1533c5926a8ad801b3688588dcc1cb2a158",
      "family": "efficient_ad",
      "metrics": {
        "artifact_size_bytes": 76535629,
        "evaluation_size": [
          256,
          256
        ],
        "gpu_latency": {
          "batch_size": 1,
          "device": "gpu",
          "p50_ms": 26.42589999993561,
          "p95_ms": 35.483935000161175,
          "samples": 162,
          "schema_version": "1.0.0",
          "setup_latency_ms": 32837.21449999757,
          "throughput_images_per_second": 36.714006658676354
        },
        "image": {
          "anomaly_count": 90,
          "auroc": 0.48302469135802467,